"Drug","Groups","Indication"
"Methdilazine","approved","Used for the symptomatic relief of hypersensitivity reactions and particularly for the control of pruritic skin disorders"
"Ethacrynic acid","approved","For the treatment of high blood pressure and edema caused by diseases like congestive heart failure, liver failure, and kidney failure."
"Ondansetron","approved","For the prevention of nausea and vomiting associated with emetogenic cancer chemotherapy, postoperation, and radiation. Also used for the treatment of postoperative nausea and vomiting."
"Bimatoprost","approved/investigational","For the reduction of elevated intraocular pressure in patients with open angle glaucoma or ocular hypertension who are intolerant of other intraocular pressure lowering medications or insufficiently responsive (failed to achieve target IOP determined after multiple measurements over time) to another intraocular pressure lowering medication."
"Tiagabine","approved","For the treatment of partial seizures"
"Cocaine","approved/illicit","For the introduction of local (topical) anesthesia of accessible mucous membranes of the oral, laryngeal and nasal cavities."
"Quinidine","approved","For the treatment of ventricular pre-excitation and cardiac dysrhythmias"
"Zonisamide","approved/investigational","For use as adjunctive treatment of partial seizures in adults with epilepsy."
"Paricalcitol","approved/investigational","For treatment of secondary hyperparathyroidism associated with chronic kidney disease (CKD) Stage 3 and 4"
"Tinidazole","approved/investigational","For the treatment of trichomoniasis caused by <i>T. vaginalis</i> in both female and male patients. Also for the treatment of giardiasis caused by <i>G. duodenalis</i> in both adults and pediatric patients older than three years of age and for the treatment of intestinal amebiasis and amebic liver abscess caused by <i>E. histolytica</i> in both adults and pediatric patients older than three years of age."
"Repaglinide","approved/investigational","As an adjunct to diet and exercise to improve glycemic control in adults with type 2 diabetes mellitus. "
"Anileridine","approved/illicit","For treatment and management of pain (systemic) and for use as an anesthesia adjunct."
"Phenformin","approved/withdrawn","For the reatment of type II diabetes mellitus."
"Amantadine","approved","For the chemoprophylaxis, prophylaxis, and treatment of signs and symptoms of infection caused by various strains of influenza A virus. Also for the treatment of parkinsonism and drug-induced extrapyramidal reactions."
"Metronidazole","approved","For the treatment of anaerobic infections and mixed infections, surgical prophylaxis requiring anaerobic coverage, Clostridium difficile-associated diarrhea and colitis, Helicobacter pylori infection and duodenal ulcer disease, bacterial vaginosis, Giardia lamblia gastro-enteritis, amebiasis caused by Entamoeba histolytica, acne rosacea (topical treatment), and Trichomonas infections."
"Dinoprostone","approved","For the termination of pregnancy during the second trimester (from the 12th through the 20th gestational week as calculated from the first day of the last normal menstrual period), as well as for evacuation of the uterine contents in the management of missed abortion or intrauterine fetal death up to 28 weeks of gestational age as calculated from the first day of the last normal menstrual period. Also used in the management of nonmetastatic gestational trophoblastic disease (benign hydatidiform mole). Other indications include improving the cervical inducibility (cervical \"ripening\") in pregnant women at or near term with a medical or obstetrical need for labor induction, and the management of postpartum hemorrhage."
"Almotriptan","approved/investigational","For the treatment of acute migraine headache in adults"
"Spectinomycin","approved","For use in the treatment of acute gonorrheal urethritis and proctitis in the male and acute gonorrheal cervicitis and proctitis in the female when due to susceptible strains of <i>Neisseria gonorrhoeae</i>."
"Ketotifen","approved","Indicated as an add-on or prophylactic oral medication in the chronic treatment of mild atopic asthmatic children. Also used as self-medication for the temporary relief of itching of the eye due to allergic conjunctivitis (ophthalmic)."
"Buprenorphine","approved/illicit/investigational","For the treatment of moderate to severe pain, peri-operative analgesia, and opioid dependence."
"Levosimendan","approved/investigational","For short term treatment of acutely decompensated severe chronic heart failure (CHF). Also being investigated for use/treatment in heart disease."
"Ceforanide","approved","For the treatment of infections caused by susceptible organisms."
"Cyclobenzaprine","approved","For use as an adjunct to rest and physical therapy for relief of muscle spasm associated with acute, painful musculoskeletal conditions."
"Phenoxybenzamine","approved","For the treatment of phaeochromocytoma (malignant), benign prostatic hypertrophy and malignant essential hypertension."
"Etretinate","withdrawn","For the treatment of severe psoriasis in adults."
"Famotidine","approved","For the treatment of peptic ulcer disease (PUD) and gastroesophageal reflux disease (GERD)."
"Azacitidine","approved/investigational","For treatment of patients with the following French-American-British myelodysplastic syndrome subtypes: refractory anemia or refractory anemia with ringed sideroblasts (if accompanied by neutropenia or thrombocytopenia or requiring transfusions), refractory anemia with excess blasts, refractory anemia with excess blasts in transformation (now classified as acute myelogenous leukemia with multilineage dysplasia), and chronic myelomonocytic leukemia."
"Misoprostol","approved","Indicated for the treatment of ulceration (duodenal, gastric and NSAID induced) and prophylaxis for NSAID induced ulceration.
Misoprostol is also indicated for other uses that are not approved in Canada, including the medical termination of an intrauterine pregnancy used alone or in combination with methotrexate,as well as the induction of labour in a selected population of pregnant women with unfavourable cervices. This indication is avoided in women with prior uterine surgery or cesarean surgery due to an increased risk of possible uterine rupture. Misoprostol is also used for the prevention or treatment of serious postpartum hemorrhage."
"Methacycline","approved","For the treatment of acute bacterial exacerbations of chronic bronchitis"
"Tipranavir","approved/investigational","For combination antiretroviral treatment of HIV-1 infected adult patients with evidence of viral replication, who are highly treatment-experienced or have HIV-1 strains resistant to multiple protease inhibitors."
"Mesoridazine","approved","Used in the treatment of schizophrenia, organic brain disorders, alcoholism and psychoneuroses."
"Maprotiline","approved","For treatment of depression, including the depressed phase of bipolar depression, psychotic depression, and involutional melancholia, and may also be helpful in treating certain patients suffering severe depressive neurosis."
"Oxymetazoline","approved","For treatment of nasal congestion and redness associated with minor irritations of the eye"
"Salicylic acid","approved","Key additive in many skin-care products for the treatment of acne, psoriasis, callouses, corns, keratosis pilaris and warts."
"Diethylpropion","approved/illicit","Used in the management of exogenous obesity as a short-term adjunct (a few weeks) in a regimen of weight reduction based on caloric restriction."
"Salmeterol","approved","For the treatment of asthma and chronic obstructive pulmonary disease (COPD)."
"Meclofenamic acid","approved","For the relief of mild to moderate pain, for the treatment of primary dysmenorrhea and for the treatment of idiopathic heavy menstrual blood loss. Also for relief of the signs and symptoms of acute and chronic rheumatoid arthritis and osteoarthritis."
"Methantheline","approved","For the treatment of peptic ulcer disease, irritable bowel syndrome, pancreatitis, gastritis, biliary dyskinesia, pylorosplasm, and reflex neurogenic bladder in children."
"Hexafluronium","approved","Used as an adjunct with succinylcholine (or suxamethonium chloride) to prolong muscle relaxation and to prevent succinylcholine-induced muscle fasciculations."
"Cycrimine","approved","For treatment and management of Parkinson's disease."
"Zalcitabine","approved","For the treatment of Human immunovirus (HIV) infections in conjunction with other antivirals."
"Demecarium","approved","For the topical treatment of chronic open-angle glaucoma."
"Acetylsalicylic acid","approved","For use in the temporary relief of various forms of pain, inflammation associated with various conditions (including rheumatoid arthritis, juvenile rheumatoid arthritis, systemic lupus erythematosus, osteoarthritis, and ankylosing spondylitis), and is also used to reduce the risk of death and/or nonfatal myocardial infarction in patients with a previous infarction or unstable angina pectoris."
"Phenprocoumon","approved","Used for the prevention and treatment of thromboembolic disease including venous thrombosis, thromboembolism, and pulmonary embolism as well as for the prevention of ischemic stroke in patients with atrial fibrillation (AF)."
"Fulvestrant","approved/investigational","For the treatment of hormone receptor positive metastatic breast cancer in postmenopausal women with disease progression following anti-estrogen therapy."
"Mezlocillin","approved","Used to treat serious gram&ndash;negative infections of the lungs, urinary tract, and skin."
"Felbamate","approved","For use only in those patients who respond inadequately to alternative treatments and whose epilepsy is so severe that a substantial risk of aplastic anemia and/or liver failure is deemed acceptable in light of the benefits conferred by its use."
"Fexofenadine","approved","For management of Seasonal allergic rhinitis"
"Isoniazid","approved","For the treatment of all forms of tuberculosis in which organisms are susceptible."
"Naratriptan","approved/investigational","For the acute treatment of migraine attacks with or without aura in adults."
"Rizatriptan","approved","For treatment of acute migraine attacks with or without aura."
"Netilmicin","approved","For the treatment of bacteremia, septicaemia, respiratory tract infections, skin and soft-tissue infection, burns, wounds, and peri-operative infections caused by susceptible strains."
"Hydrocodone","approved/illicit","For relief of moderate to moderately severe pain. Also used for the symptomatic relief of nonproductive cough, alone or in combination with other antitussives or expectorants."
"Norgestimate","approved","For the prevention of pregnancy"
"Carboplatin","approved","For the initial treatment of advanced ovarian carcinoma in established combination with other approved chemotherapeutic agents. One established combination regimen consists of PARAPLATIN and cyclophosphamide. It is also indicated for the palliative treatment of patients with ovarian carcinoma recurrent after prior chemotherapy, including patients who have been previously treated with cisplatin. "
"Methylprednisolone","approved","Adjunctive therapy for short-term administration in rheumatoid arthritis."
"Pindolol","approved","For the management of hypertension, edema, ventricular tachycardias, and atrial fibrillation."
"Mepivacaine","approved","For production of local or regional analgesia and anesthesia by local infiltration, peripheral nerve block techniques, and central neural techniques including epidural and caudal blocks."
"Zaleplon","approved/illicit/investigational","For the treatment of short-term treatment of insomnia in adults."
"Bromfenac","approved","For the treatment of postoperative inflammation in patients who have undergone cataract extraction."
"Apraclonidine","approved","For prevention or reduction of intraoperative and postoperative increases in intraocular pressure (IOP) before and after ocular laser surgery when used prophylactically. Also used as a short-term adjunctive therapy in patients with open-angle glaucoma who are on maximally tolerated medical therapy requiring additional IOP reduction."
"Telmisartan","approved/investigational","Used alone or in combination with other classes of antihypertensives for the treatment of hypertension. Also used in the treatment of diabetic nephropathy in hypertensive patients with type 2 diabetes mellitus, as well as the treatment of congestive heart failure (only in patients who cannot tolerate ACE inhibitors)."
"Desloratadine","approved/investigational","For the relief of symptoms of seasonal allergic rhinitis, perennial (non-seasonal) allergic rhinitis. Desloratidine is also used for the sympomatic treatment of pruritus and urticaria (hives) associated with chronic idiopathic urticaria."
"Methyldopa","approved","For use in the treatment of hypertension."
"Alosetron","approved/withdrawn","Only for the treatment of symptoms of severe diarrhea-predominant irritable bowel syndrome (IBS) in women with chronic symptoms (generally lasting greater than 6 months) who does not present with anatomic or biochemical GI abnormalities and have not responded to conventional therapy."
"Dactinomycin","approved","For the treatment of Wilms' tumor, childhood rhabdomyosarcoma, Ewing's sarcoma and metastatic, nonseminomatous testicular cancer as part of a combination chemotherapy and/or multi-modality treatment regimen"
"Azelastine","approved","For the symptomatic treatment of seasonal allergic rhinitis and non-allergic rhinitis, as well as symptomatic relief of ocular itching associated with allergic conjunctivitis."
"Ezetimibe","approved","For use as adjunctive therapy to diet for the reduction of elevated total-C, LDL-C, and Apo B in patients with primary (heterozygous familial and non-familial) hypercholesterolemia."
"Edetic Acid","approved","For the reduction of blood levels and depot stores of lead in lead poisoning (acute and chronic) and lead encephalopathy, in both pediatric populations and adults."
"Dipyridamole","approved","For as an adjunct to coumarin anticoagulants in the prevention of postoperative thromboembolic complications of cardiac valve replacement and also used in prevention of angina."
"Telithromycin","approved","For the treatment of <i>Pneumococcal</i> infection, acute sinusitis, acute bacterial tonsillitis, acute bronchitis and bronchiolitis, lower respiratory tract infection and lobar (pneumococcal) pneumonia."
"Ethinyl Estradiol","approved","For treatment of moderate to severe vasomotor symptoms associated with the menopause, female hypogonadism, prostatic carcinoma-palliative therapy of advanced disease, breast cancer, as an oral contraceptive, and as emergency contraceptive."
"Lomefloxacin","approved","For the treatment of bacterial infections of the respiratory tract (chronic bronchitis) and urinary tract, and as a pre-operative prophylactic to prevent urinary tract infection caused by: <i>S.pneumoniae</i>, <i>H.influenzae</i>, <i>S.aureus</i>, <i>P.aeruginosa</i>, <i>E. cloacae</i>, <i>P. mirabilis</i>, <i>C. civersus</i>, <i>S. asprphyticus</i>, <i>E.coli</i>, and <i>K.pneumoniae</i>."
"Cyclopentolate","approved","Used mainly to produce mydriasis and cycloplegia for diagnostic purposes."
"Ramelteon","approved/investigational","For the treatment of insomnia characterized by difficulty with sleep onset."
"Physostigmine","approved","For the treatment of glaucoma, and in the treatment of severe anticholinergic toxicity."
"Isotretinoin","approved","For the treatment of severe recalcitrant nodular acne"
"Formoterol","approved/investigational","For use as long-term maintenance treatment of asthma in patients 6 years of age and older with reversible obstructive airways disease, including patients with symptoms of nocturnal asthma, who are using optimal corticosteroid treatment and experiencing regular or frequent breakthrough symptoms requiring use of a short-acting bronchodilator. Not indicated for asthma that can be successfully managed with occasional use of an inhaled, short-acting beta2-adrenergic agonist. Also used for the prevention of exercise-induced bronchospasm, as well as long-term treatment of bronchospasm associated with COPD."
"Nandrolone phenpropionate","approved/illicit","For the treatment of refractory deficient red cell production anemias, breast carcinoma, hereditary angioedema, antithrombin III deficiency, fibrinogen excess, growth failure and Turner's syndrome. It is also indicated in the prophylaxis of hereditary angioedema."
"Dimenhydrinate","approved","Used for treating vertigo, motion sickness, and nausea associated with pregnancy."
"Glycopyrrolate","approved/investigational","For use as a preoperative antimuscarinic to reduce salivary, tracheobronchial, and pharyngeal secretions, to reduce the volume and free acidity of gastric secretions and to block cardiac vagal inhibitory reflexes during induction of anesthesia and intubation."
"Cytarabine","approved/investigational","For the treatment of acute non-lymphocytic leukemia, acute lymphocytic leukemia and blast phase of chronic myelocytic leukemia."
"Dopamine","approved","For the correction of hemodynamic imbalances present in the shock syndrome due to myocardial infarction, trauma, endotoxic septicemia, open-heart surgery, renal failure, and chronic cardiac decompensation as in congestive failure"
"Rivastigmine","approved/investigational","For the treatment of mild to moderate dementia associated with Parkinson's disease or of the Alzheimer's type."
"Exemestane","approved/investigational","For the treatment of advanced breast cancer in postmenopausal women whose disease has progressed following tamoxifen therapy."
"Oxaprozin","approved","Used to relieve the inflammation, swelling, stiffness, and joint pain associated with rheumatoid arthritis and osteoarthritis."
"Methyl aminolevulinate","approved","For topical use, in combination with 570 to 670 nm wavelength red light illumination, in the treatment of non-hyperkeratotic actinic keratoses of the face and scalp in immunocompetent patients when used in conjunction with lesion preparation (debridement using a sharp dermal curette)."
"Azathioprine","approved","For use in rheumatoid arthritis, preventing renal transplant rejection, Crohn's disease, and colitis."
"Neomycin","approved","Topical uses include treatment for superficial eye infections caused by susceptible bacteria (used in combination with other antiinfectives), treatment of otitis externa caused by susceptible bacteria, treatment or prevention of bacterial infections in skin lesions, and use as a continuous short-term irrigant or rinse to prevent bacteriuria and gram negative rod bacteremia in abacteriuric patients with indwelling catheters. May be used orally to treat hepatic encephalopathy, as a perioperative prophylactic agent, and as an adjunct to fluid and electrolyte replacement in the treatment of diarrhea caused to enteropathogenic E. coli (EPEC). "
"Auranofin","approved","Used in the treatment of active, progressive or destructive forms of inflammatory arthritis, such as adult rheumatoid arthritis."
"Gabapentin","approved/investigational","For the management of postherpetic neuralgia in adults and as adjunctive therapy in the treatment of partial seizures with and without secondary generalization in patients over 12 years of age with epilepsy."
"Doxorubicin","approved/investigational","Doxorubicin is used to produce regression in disseminated neoplastic conditions like acute lymphoblastic leukemia, acute myeloblastic leukemia, Wilms’ tumor, neuroblastoma, soft tissue and bone sarcomas, breast carcinoma, ovarian carcinoma, transitional cell bladder carcinoma, thyroid carcinoma, gastric carcinoma, Hodgkin’s disease, malignant lymphoma and bronchogenic carcinoma in which the small cell histologic type is the most responsive compared to other cell types. Doxorubicin is also indicated for use as a component of adjuvant therapy in women with evidence of axillary lymph node involvement following resection of primary breast cancer."
"Frovatriptan","approved/investigational","For the acute treatment of migraine attacks with or without aura in adults."
"Hydrochlorothiazide","approved","For the treatment of high blood pressure and management of edema."
"Cyclacillin","approved","For the treatment of bacterial infections caused by susceptible organisms."
"Salbutamol","approved","For symptomatic relief and prevention of bronchospasm due to bronchial asthma, chronic bronchitis, and other chronic bronchopulmonary disorders such as COPD. "
"Levobupivacaine","approved","For the production of local or regional anesthesia for surgery and obstetrics, and for post-operative pain management"
"Cromoglicic acid","approved","For the management of patients with bronchial asthma. Also used in the treatment of vernal keratoconjunctivitis, vernal conjunctivitis, and vernal keratitis."
"Ganciclovir","approved/investigational","For induction and maintenance in the treatment of cytomegalovirus (CMV) retinitis in immunocompromised patients, including patients with acquired immunodeficiency syndrome (AIDS). Also used in the treatment of severe cytomegalovirus (CMV) disease, including CMV pneumonia, CMV gastrointestinal disease, and disseminated CMV infections, in immunocompromised patients."
"Hydroxyurea","approved","For management of melanoma, resistant chronic myelocytic leukemia, and recurrent, metastatic, or inoperable carcinoma of the ovary and Sickle-cell anemia."
"Letrozole","approved/investigational","For the extended adjuvant treatment of early breast cancer in postmenopausal women who have received 5 years of adjuvant tamoxifen therapy. Also for first-line treatment of postmenopausal women with hormone receptor positive or hormone receptor unknown locally advanced or metastatic breast cancer. Also indicated for the treatment of advanced breast cancer in postmenopausal women with disease progression following antiestrogen therapy."
"Tioconazole","approved","For the local treatment of vulvovaginal candidiasis (moniliasis)."
"Busulfan","approved/investigational","For use in combination with cyclophosphamide as a conditioning regimen prior to allogeneic hematopoietic progenitor cell transplantation for chronic myelogenous  (myeloid, myelocytic, granulocytic) leukemia (FDA has designated busulfan as an orphan drug for this use). It is also used as a component of pretransplant conditioning regimens in patients undergoing bone marrow transplantation for acute myeloid leukemia and nonmalignant diseases."
"Ketoprofen","approved","For symptomatic treatment of acute and chronic rheumatoid arthritis, osteoarthritis, ankylosing spondylitis, primary dysmenorrhea and mild to moderate pain associated with musculotendinous trauma (sprains and strains), postoperative (including dental surgery) or postpartum pain."
"Edrophonium","approved","For the differential diagnosis of myasthenia gravis and as an adjunct in the evaluation of treatment requirements in this disease. It may also be used for evaluating emergency treatment in myasthenic crises."
"Metyrapone","approved","Used as a diagnostic drug for testing hypothalamic-pituitary ACTH function. Occasionally used in Cushing's syndrome."
"Cinacalcet","approved","For the treatment of secondary hyperparathyroidism in patients with Chronic Kidney Disease who are on hemodialysis or peritoneal dialysis. Also for the treatment of hypercalcemia in patients with parathyroid carcinoma."
"Clobetasol propionate","approved","For short-term topical treatment of the inflammatory and pruritic manifestations of moderate to severe corticosteroid-responsive dermatoses of the scalp."
"Balsalazide","approved/investigational","For the treatment of mildly to moderately active ulcerative colitis."
"Sulfamethoxazole","approved","For the treatment bacterial infections causing bronchitis, prostatitis and urinary tract infections."
"Glyburide","approved","Indicated as an adjunct to diet to lower the blood glucose in patients with NIDDM whose hyperglycemia cannot be satisfactorily controlled by diet alone."
"Minocycline","approved/investigational","For the treatment of infections caused by susceptible strains of microorganisms, such as Rocky Mountain spotted fever, typhus fever and the typhus group, Q fever, rickettsial pox and tick fevers caused by Rickettsiae, upper respiratory tract infections caused by <i>Streptococcus pneumoniae</i> and for the treatment of asymptomatic carriers of <i>Neisseria meningitidis</i>."
"Guanfacine","approved/investigational","For use alone or in combination with other classes of antihypertensive agents in the management of hypertension. Has also been used for the treatment of attention deficit hyperactivity disorder (ADHD) in pediatric patients."
"Bethanechol","approved","For the treatment of acute postoperative and postpartum nonobstructive (functional) urinary retention and for neurogenic atony of the urinary bladder with retention."
"Isosorbide Mononitrate","approved","For the prevention of angina pectoris due to coronary artery disease and the treatment of acute and chronic angina pectoris, hypertension, and myocardial infarction."
"Trichlormethiazide","approved","Used in the treatment of oedema (including that associated with heart failure) and hypertension."
"Phylloquinone","approved","For the treatment of haemorrhagic conditions in infants, antidote for coumarin anticoagulants in hypoprothrombinaemia."
"Felodipine","approved/investigational","For the treatment of mild to moderate essential hypertension. "
